title;description;deadline;completed;duration;importance;hatelevel
Salter-Harris Type II physeal fracture of lower end of unspecified femur, subsequent encounter for fracture with nonunion;Partial traumatic amputation of unspecified foot at ankle level;;False;6743;4;4
Legal intervention involving injury by machine gun, suspect injured;Nondisplaced oblique fracture of shaft of left ulna, subsequent encounter for open fracture type IIIA, IIIB, or IIIC with delayed healing;;True;7269;0;2
Hallucinogen dependence, uncomplicated;Burn of third degree of chin;2023-12-09T00:00:00.0000000+01:00;True;54608;1;3
Corrosion of unspecified degree of left foot, initial encounter;Ischemic optic neuropathy, unspecified eye;;False;4224;4;1
Cannabis use, unspecified with intoxication delirium;Spontaneous ecchymoses;;False;77128;2;0
Laceration without foreign body of right cheek and temporomandibular area, sequela;Burn of first degree of back of left hand;;True;18692;4;4
Poisoning by other parasympatholytics [anticholinergics and antimuscarinics] and spasmolytics, accidental (unintentional), initial encounter;Asphyxiation due to smothering under pillow, assault, subsequent encounter;;False;11425;0;4
Unspecified displaced fracture of surgical neck of right humerus, subsequent encounter for fracture with malunion;Unspecified open wound of trachea, subsequent encounter;2023-09-12T00:00:00.0000000+02:00;True;20180;4;1
Bather struck by nonpowered watercraft, subsequent encounter;Other open wound of other specified part of neck, initial encounter;2024-02-01T00:00:00.0000000+01:00;True;38309;1;0
Contact with unspecified agricultural machinery, subsequent encounter;Displaced fracture of proximal phalanx of unspecified finger, subsequent encounter for fracture with nonunion;2023-08-09T00:00:00.0000000+02:00;True;4816;0;0
Unspecified open wound of left lesser toe(s) with damage to nail;Amputation of limb(s) as the cause of abnormal reaction of the patient, or of later complication, without mention of misadventure at the time of the procedure;;False;50793;4;4
Burn of unspecified degree of multiple sites of right shoulder and upper limb, except wrist and hand, sequela;Nondisplaced segmental fracture of shaft of left tibia, subsequent encounter for open fracture type IIIA, IIIB, or IIIC with routine healing;2024-02-08T00:00:00.0000000+01:00;False;36140;2;4
Twin pregnancy, unspecified number of placenta and unspecified number of amniotic sacs;Toxic effect of other specified inorganic substances, accidental (unintentional), sequela;;True;72009;2;4
Fracture of cuboid bone;Poisoning by, adverse effect of and underdosing of predominantly beta-adrenoreceptor agonists;;False;58043;2;1
Unspecified injury of left Achilles tendon, initial encounter;Dermatophytosis;2023-12-11T00:00:00.0000000+01:00;True;1669;4;2
Benign neoplasm of unspecified site of orbit;Toxic effect of other ingested (parts of) plant(s), accidental (unintentional), subsequent encounter;;False;10851;3;4
Corrosion of unspecified degree of right forearm, subsequent encounter;Jumping or diving into unspecified water causing other injury, sequela;;False;43571;3;4
Other mechanical complication of implanted electronic neurostimulator, generator, sequela;Preterm labor with preterm delivery, unspecified trimester, fetus 4;;True;27493;1;4
Unspecified occupant of other special all-terrain or other off-road motor vehicle injured in traffic accident, initial encounter;Underdosing of unspecified antidepressants;2024-08-08T00:00:00.0000000+02:00;False;16970;0;4
Ophiasis;Wedge compression fracture of fifth lumbar vertebra, subsequent encounter for fracture with routine healing;2024-11-03T00:00:00.0000000+01:00;True;20945;2;1
Nondisplaced subtrochanteric fracture of left femur, initial encounter for open fracture type IIIA, IIIB, or IIIC;Type 1 diabetes mellitus with mild nonproliferative diabetic retinopathy without macular edema, bilateral;2023-03-09T00:00:00.0000000+01:00;True;28584;3;1
Injury of olfactory [1st ] nerve, right side, sequela;Follicular lymphoma grade I, intrathoracic lymph nodes;2024-02-09T00:00:00.0000000+01:00;True;28052;4;4
Nondisplaced fracture of lesser trochanter of unspecified femur;Displaced transverse fracture of shaft of unspecified tibia, initial encounter for closed fracture;2024-09-05T00:00:00.0000000+02:00;False;5276;3;3
Person injured while boarding or alighting from special agricultural vehicle, subsequent encounter;Sprain of jaw, left side, sequela;;True;18853;2;2
Congenital occlusion of ureterovesical orifice;Burn of second degree of unspecified foot, subsequent encounter;;False;47507;1;1
Infective myositis, unspecified foot;Displaced fracture of trapezoid [smaller multangular], unspecified wrist, initial encounter for closed fracture;2024-10-01T00:00:00.0000000+02:00;False;20638;4;0
Open bite of unspecified front wall of thorax with penetration into thoracic cavity, sequela;Dislocation of unspecified parts of left shoulder girdle, subsequent encounter;2024-01-07T00:00:00.0000000+01:00;True;75526;1;1
Abnormal and inconclusive findings on diagnostic imaging of breast;Burn of first degree of multiple sites of left shoulder and upper limb, except wrist and hand, initial encounter;;True;11115;3;0
Laceration of intercostal blood vessels, left side;Nondisplaced transverse fracture of shaft of left femur, subsequent encounter for open fracture type IIIA, IIIB, or IIIC with malunion;2024-07-01T00:00:00.0000000+02:00;False;83373;1;2
Nondisplaced pilon fracture of left tibia, subsequent encounter for open fracture type IIIA, IIIB, or IIIC with malunion;Superficial frostbite of other sites, subsequent encounter;;True;50407;3;2
Disorders of ketone metabolism;Oligohydramnios, unspecified trimester, fetus 5;;False;81004;2;0
Infestation, unspecified;Other specified disorders of penis;;True;86044;4;2
Open bite of left cheek and temporomandibular area, sequela;Burn of unspecified degree of hand, unspecified site;2023-11-10T00:00:00.0000000+01:00;False;24170;3;0
Contusion of scrotum and testes, sequela;Burn of second degree of unspecified axilla, subsequent encounter;;True;14056;3;1
Miotic pupillary cyst, left eye;Colles' fracture of right radius, subsequent encounter for open fracture type I or II with delayed healing;;True;15722;0;2
Other secondary chronic gout, shoulder;Contact with nonvenomous frogs, sequela;;True;14429;1;4
Injury of unspecified nerve at ankle and foot level, left leg, initial encounter;Telogen effluvium;;True;69793;3;3
Acute suppurative otitis media without spontaneous rupture of ear drum, recurrent, left ear;Cysts of eyelid;2024-02-04T00:00:00.0000000+01:00;False;22865;0;4
Burn of unspecified degree of unspecified site of unspecified lower limb, except ankle and foot, subsequent encounter;Circadian rhythm sleep disorder, jet lag type;;True;58244;4;3
Nondisplaced fracture of lesser trochanter of right femur, subsequent encounter for open fracture type I or II with malunion;Disseminated histoplasmosis capsulati;2024-06-02T00:00:00.0000000+02:00;False;65121;2;3
Nondisplaced spiral fracture of shaft of ulna, left arm, subsequent encounter for closed fracture with routine healing;Other fracture of shaft of right tibia, initial encounter for closed fracture;;False;23668;4;4
Displaced oblique fracture of shaft of left tibia, subsequent encounter for closed fracture with nonunion;Strain of flexor muscle, fascia and tendon of right middle finger at forearm level, initial encounter;2023-04-11T00:00:00.0000000+02:00;False;23148;1;4
Hyponasality;Barton's fracture of left radius, subsequent encounter for open fracture type IIIA, IIIB, or IIIC with routine healing;;False;44219;0;3
Chorioretinal inflammation;Driver of three-wheeled motor vehicle injured in collision with two- or three-wheeled motor vehicle in nontraffic accident, subsequent encounter;;False;14417;4;4
Unspecified displaced fracture of first cervical vertebra, subsequent encounter for fracture with routine healing;Obturator dislocation of unspecified hip, initial encounter;;False;76569;0;3
Embryonic cyst of fallopian tube;Type 1 diabetes mellitus with mild nonproliferative diabetic retinopathy without macular edema, left eye;2024-12-01T00:00:00.0000000+01:00;True;58240;4;1
Other transitory neonatal endocrine disorders;Laceration with foreign body of right middle finger with damage to nail, initial encounter;;True;6785;1;2
Displaced transverse fracture of shaft of unspecified ulna, subsequent encounter for open fracture type I or II with routine healing;Displaced fracture of epiphysis (separation) (upper) of unspecified femur, initial encounter for open fracture type IIIA, IIIB, or IIIC;2023-06-11T00:00:00.0000000+02:00;False;70257;2;3
Osteopathy in diseases classified elsewhere, unspecified ankle and foot;Other specified injury of unspecified blood vessel at hip and thigh level;2024-05-05T00:00:00.0000000+02:00;False;38702;2;3
Burn with resulting rupture and destruction of left eyeball, sequela;Monoarthritis, not elsewhere classified, unspecified knee;2023-04-10T00:00:00.0000000+02:00;True;25125;1;4
Longitudinal reduction defect of right tibia;Neoplasm of unspecified behavior of unspecified site;2024-07-08T00:00:00.0000000+02:00;False;80834;3;1
Crushing injury of unspecified hand;Passenger in heavy transport vehicle injured in collision with car, pick-up truck or van in traffic accident, subsequent encounter;;True;2612;4;1
Salter-Harris Type I physeal fracture of lower end of unspecified femur, subsequent encounter for fracture with delayed healing;Displaced fracture of unspecified tibial spine, subsequent encounter for open fracture type IIIA, IIIB, or IIIC with nonunion;2024-12-08T00:00:00.0000000+01:00;False;19338;1;3
Contusion of other specified intrathoracic organs;Unspecified foreign body in larynx causing other injury, sequela;;False;4031;1;4
Nondisplaced fracture of coracoid process, unspecified shoulder, subsequent encounter for fracture with delayed healing;Viral agents as the cause of diseases classified elsewhere;2024-07-08T00:00:00.0000000+02:00;True;3480;3;0
Traumatic rupture of unspecified ligament of left wrist, sequela;Intermittent hydrarthrosis, unspecified knee;2024-06-07T00:00:00.0000000+02:00;False;20718;1;2
Nondisplaced fracture of distal phalanx of right middle finger;Displaced fracture of unspecified tibial spine, initial encounter for closed fracture;;True;21300;0;0
Iris atrophy (essential) (progressive), bilateral;Other dislocation of left radial head, initial encounter;;False;84574;2;0
Prosthetic and other implants, materials and accessory anesthesiology devices associated with adverse incidents;Family history of blindness and visual loss;2023-11-09T00:00:00.0000000+01:00;False;47724;2;3
Legal intervention involving other gas;Injury of prostate;2024-08-04T00:00:00.0000000+02:00;False;233;1;4
Sedative, hypnotic, or anxiolytic use, unspecified, uncomplicated;Type III traumatic spondylolisthesis of second cervical vertebra;2024-11-08T00:00:00.0000000+01:00;False;16110;4;3
Military operations involving explosion of sea-based artillery shell, military personnel, subsequent encounter;Bather struck by powered watercraft, initial encounter;;True;39155;4;4
Cerebral infarction due to thrombosis of carotid artery;Military firearm discharge, undetermined intent;;True;72263;4;2
Other specified fracture of left pubis, subsequent encounter for fracture with delayed healing;Laceration of other specified blood vessels at shoulder and upper arm level, right arm;2024-06-02T00:00:00.0000000+02:00;False;688;1;1
Solitary bone cyst, humerus;Nondisplaced fracture of middle third of navicular [scaphoid] bone of right wrist, initial encounter for closed fracture;;True;73875;1;4
Other infective (teno)synovitis, unspecified ankle and foot;Corrosion of unspecified degree of multiple sites of unspecified wrist and hand;2024-11-01T00:00:00.0000000+01:00;True;54446;1;0
Shock due to being struck by lightning, sequela;Displaced segmental fracture of shaft of right tibia, subsequent encounter for open fracture type IIIA, IIIB, or IIIC with routine healing;;False;67772;4;3
Collapsed vertebra, not elsewhere classified, site unspecified, subsequent encounter for fracture with routine healing;Bilateral femoral hernia, with gangrene, recurrent;;False;70045;2;0
Traumatic rupture of palmar ligament of left ring finger at metacarpophalangeal and interphalangeal joint, initial encounter;Chilblains, initial encounter;;True;39378;0;2
Twin pregnancy;Displaced fracture of lateral condyle of unspecified tibia, sequela;;False;52783;2;4
Animal-rider or occupant of animal-drawn vehicle injured in collision with other nonmotor vehicles;Puncture wound without foreign body of lower back and pelvis with penetration into retroperitoneum;2024-05-02T00:00:00.0000000+02:00;False;39058;4;0
Strain of muscle and tendon of head, subsequent encounter;Toxic effect of nitrogen oxides, accidental (unintentional), subsequent encounter;;False;15479;3;2
Other infective otitis externa, left ear;Other soft tissue disorders related to use, overuse and pressure;2024-12-05T00:00:00.0000000+01:00;True;49228;4;4
Explosion on board passenger ship, initial encounter;Unspecified mental disorder due to known physiological condition;2023-08-09T00:00:00.0000000+02:00;True;24254;3;3
Contact blepharoconjunctivitis, right eye;Drowning and submersion due to merchant ship sinking, sequela;;False;21782;3;3
Jumping or diving into other water striking water surface causing drowning and submersion, initial encounter;Other and unspecified injuries of lung;2024-01-09T00:00:00.0000000+01:00;False;75082;0;3
Other specified injury of superficial palmar arch of left hand, initial encounter;Nondisplaced fracture of pisiform, left wrist, subsequent encounter for fracture with nonunion;;True;3881;0;3
Absent nipple;Fracture of unspecified phalanx of left middle finger;2024-09-08T00:00:00.0000000+02:00;False;62328;1;2
Laceration with foreign body of unspecified toe(s) without damage to nail, subsequent encounter;Myelodysplastic disease, not classified;;False;39750;0;3
Open bite of right buttock, sequela;Other chorea;2024-01-02T00:00:00.0000000+01:00;False;68655;1;0
Wedge compression fracture of fourth thoracic vertebra;Uterine size-date discrepancy, third trimester;;True;6773;4;4
Transient synovitis, left shoulder;Unspecified occupant of three-wheeled motor vehicle injured in collision with unspecified motor vehicles in nontraffic accident, subsequent encounter;;True;41457;0;1
Nontraumatic ischemic infarction of muscle, left forearm;Exposure to unspecified man-made visible and ultraviolet light, sequela;;False;39684;3;3
Unspecified hang-glider accident injuring occupant, subsequent encounter;Nondisplaced fracture of medial condyle of left humerus, subsequent encounter for fracture with nonunion;2024-01-09T00:00:00.0000000+01:00;False;41186;1;2
Paresis of accommodation, right eye;Other female intestinal-genital tract fistulae;2023-09-10T00:00:00.0000000+02:00;True;44190;1;4
Fall from or off toilet with subsequent striking against object, sequela;Unilateral osteoarthritis resulting from hip dysplasia;;True;56686;0;2
Contusion and laceration of left cerebrum with loss of consciousness greater than 24 hours without return to pre-existing conscious level with patient surviving, subsequent encounter;Fracture of coronoid process of mandible, unspecified side, subsequent encounter for fracture with delayed healing;2024-06-04T00:00:00.0000000+02:00;False;41546;4;3
Nondisplaced segmental fracture of shaft of unspecified fibula, subsequent encounter for open fracture type I or II with malunion;Contact with scissors, initial encounter;;False;42911;1;3
Unspecified motorcycle rider injured in collision with unspecified motor vehicles in nontraffic accident, sequela;Thiamine deficiency;2024-08-02T00:00:00.0000000+02:00;False;66784;1;3
Contusion of ovary, unspecified;Displaced fracture of lower epiphysis (separation) of right femur, subsequent encounter for open fracture type I or II with delayed healing;;False;43747;3;0
Displaced spiral fracture of shaft of right tibia, initial encounter for closed fracture;Striking against or struck by other objects, subsequent encounter;;True;83974;1;0
Other private fixed-wing aircraft explosion injuring occupant;Superficial injury of neck;;False;64950;1;2
Displaced unspecified fracture of left great toe, initial encounter for open fracture;Cor pulmonale (chronic);;True;22859;1;3
Pedal cycle passenger injured in collision with other motor vehicles in nontraffic accident, subsequent encounter;Tuberculous chorioretinitis;;False;40790;3;1
Toxic effect of contact with Portugese Man-o-war, undetermined, initial encounter;Injury of other nerves at wrist and hand level of unspecified arm, sequela;2024-04-01T00:00:00.0000000+02:00;False;82318;2;4
Other complications following infusion, transfusion and therapeutic injection;Intentional collision of motor vehicle with tree, initial encounter;;False;83466;4;3
Puncture wound with foreign body of left hand;Other juvenile arthritis, left shoulder;;False;48241;4;1
Displaced fracture of head of right radius, initial encounter for closed fracture;Assault by letter bomb, sequela;2024-07-06T00:00:00.0000000+02:00;True;52813;2;1
Traumatic arthropathy, other specified site;Non-ABO incompatibility reaction due to transfusion of blood or blood products, unspecified;;True;30632;3;0
Calcium deposit in bursa, left elbow;Other disorders of conjunctiva;2024-07-02T00:00:00.0000000+02:00;True;39080;0;3
Anterior cord syndrome at T11-T12 level of thoracic spinal cord;(Induced) termination of pregnancy with other complications;;False;81703;0;3
Open bite of abdominal wall with penetration into peritoneal cavity;Child sexual abuse, suspected;;True;8896;2;3
Other fracture of lower end of right ulna, initial encounter for closed fracture;Nondisplaced fracture of epiphysis (separation) (upper) of left femur, subsequent encounter for open fracture type IIIA, IIIB, or IIIC with malunion;2024-09-06T00:00:00.0000000+02:00;False;85536;1;0
Unspecified occupant of three-wheeled motor vehicle injured in collision with car, pick-up truck or van in traffic accident, subsequent encounter;Double outlet left ventricle;2024-04-05T00:00:00.0000000+02:00;True;47871;1;2
Other specified injuries of right ankle, subsequent encounter;Rheumatoid bursitis, unspecified site;;False;32265;3;2
Toxic effect of venom of other snake, accidental (unintentional), initial encounter;Contusion of left ring finger without damage to nail, initial encounter;2024-06-04T00:00:00.0000000+02:00;False;75797;2;2
Maternal care for unspecified congenital malformation of uterus, unspecified trimester;Nondisplaced unspecified fracture of right lesser toe(s), initial encounter for closed fracture;;True;23140;0;0
Granulation of postmastoidectomy cavity;Thromboembolism in pregnancy, second trimester;2024-08-03T00:00:00.0000000+02:00;True;65777;1;1
Unspecified car occupant injured in collision with van in nontraffic accident, subsequent encounter;Osteonecrosis in diseases classified elsewhere, unspecified forearm;;False;71411;2;2
Endocrine, nutritional and metabolic diseases complicating pregnancy, childbirth and the puerperium;Occupant of animal-drawn vehicle injured in collision with other animal-drawn vehicle;;False;60168;1;1
Chronic migraine without aura;Burn of first degree of right foot, sequela;2023-09-11T00:00:00.0000000+02:00;False;71942;4;2
Unspecified Eustachian salpingitis, right ear;Nondisplaced comminuted fracture of shaft of right femur, initial encounter for open fracture type IIIA, IIIB, or IIIC;;False;20783;0;0
Nondisplaced subtrochanteric fracture of right femur, subsequent encounter for open fracture type IIIA, IIIB, or IIIC with delayed healing;Encounter for fitting and adjustment of unspecified right artificial leg;;True;35221;3;0
Pinguecula, bilateral;Cerebral infarction due to thrombosis of left middle cerebral artery;;False;51959;3;4
Unspecified open wound of unspecified wrist, initial encounter;Obstruction due to foreign body accidentally left in body following endoscopic examination, sequela;;True;69543;3;0
Contusion and laceration of cerebrum, unspecified, with loss of consciousness greater than 24 hours with return to pre-existing conscious level, initial encounter;Rheumatic fever with heart involvement;2024-09-06T00:00:00.0000000+02:00;True;63303;3;4
Congenital rubella syndrome;Nondisplaced fracture of medial condyle of left tibia, subsequent encounter for closed fracture with delayed healing;;False;52678;3;0
Mycetoma;Displaced fracture of unspecified radial styloid process, subsequent encounter for open fracture type IIIA, IIIB, or IIIC with malunion;;False;9911;3;2
Other subluxation of left foot, sequela;Frostbite with tissue necrosis of left arm, initial encounter;;False;21797;3;1
Pleural plaque with presence of asbestos;Diffuse follicle center lymphoma;2023-03-09T00:00:00.0000000+01:00;False;27089;4;1
Other drug induced dystonia;Other mechanical complication of balloon (counterpulsation) device, subsequent encounter;;True;60370;2;1
Reiter's disease, unspecified hip;Poisoning by unspecified psychotropic drug, intentional self-harm, subsequent encounter;;True;3300;2;0
Bitten by parrot, subsequent encounter;Opioid use, unspecified with opioid-induced psychotic disorder;2024-05-02T00:00:00.0000000+02:00;True;6244;4;0
Toxic effect of methanol, undetermined;Epidural hemorrhage with loss of consciousness of 30 minutes or less, subsequent encounter;;True;24688;3;1
Other early congenital syphilis, symptomatic;Major laceration of spleen, sequela;;True;74508;0;3
Poisoning by other hormones and synthetic substitutes, accidental (unintentional), sequela;Unspecified Zone I fracture of sacrum, subsequent encounter for fracture with routine healing;;False;66673;3;4
Egg (Oocyte) donor;Burn of second degree of multiple sites of unspecified lower limb, except ankle and foot, initial encounter;;True;57328;3;1
Other specified diabetes mellitus with circulatory complications;Poisoning by other hormones and synthetic substitutes, accidental (unintentional), sequela;;False;7755;1;4
Mood disorder due to known physiological condition with major depressive-like episode;Pedal cycle passenger injured in collision with railway train or railway vehicle in traffic accident, subsequent encounter;;False;2166;3;1
Displaced comminuted fracture of right patella;Chronic tension-type headache;2024-11-01T00:00:00.0000000+01:00;False;59447;2;0
Nondisplaced oblique fracture of shaft of left femur, subsequent encounter for closed fracture with routine healing;Other low birth weight newborn, 1500-1749 grams;;False;553;2;2
Displaced segmental fracture of shaft of unspecified femur, initial encounter for closed fracture;Unspecified open wound of penis;;True;39883;1;2
Toxic effect of zinc and its compounds, intentional self-harm, subsequent encounter;Unspecified physeal fracture of lower end of radius, unspecified arm;2024-03-08T00:00:00.0000000+01:00;False;83514;4;1
Fall (on) (from) other stairs and steps, subsequent encounter;Burn of third degree of forearm;2023-06-11T00:00:00.0000000+02:00;True;57839;0;4
Fracture of body of sternum, sequela;Displaced fracture of navicular [scaphoid] of unspecified foot, subsequent encounter for fracture with routine healing;;True;83141;0;3
Pedestrian with other conveyance injured in collision with pedal cycle in traffic accident, sequela;Person with feared health complaint in whom no diagnosis is made;;False;60907;4;3
Displaced fracture of shaft of left clavicle;Other infection carrier state complicating the puerperium;;False;8995;1;4
Blister (nonthermal) of right hand;3-part fracture of surgical neck of right humerus, subsequent encounter for fracture with delayed healing;2024-04-04T00:00:00.0000000+02:00;True;40921;3;0
Nondisplaced fracture of distal phalanx of left little finger, sequela;Poisoning by anticholinesterase agents, intentional self-harm, initial encounter;2023-01-10T00:00:00.0000000+01:00;False;21303;0;1
Maternal care for unstable lie, fetus 3;Nondisplaced fracture of shaft of first metacarpal bone, left hand, subsequent encounter for fracture with routine healing;;False;19680;1;3
Embolism due to other internal prosthetic devices, implants and grafts, subsequent encounter;Injury of unspecified nerve at forearm level, left arm, initial encounter;2023-03-12T00:00:00.0000000+01:00;True;28468;3;3
Type 1 fracture of sacrum, subsequent encounter for fracture with delayed healing;Term delivery with preterm labor, second trimester;;True;75236;0;0
Toxic effect of chlorine gas, undetermined, initial encounter;Displaced osteochondral fracture of left patella, initial encounter for open fracture type I or II;2023-06-09T00:00:00.0000000+02:00;True;58560;2;4
Nondisplaced segmental fracture of shaft of radius, right arm, initial encounter for closed fracture;War operations involving explosion of depth-charge, civilian, subsequent encounter;;True;17343;2;1
Corrosion of second degree of left scapular region, subsequent encounter;Unspecified traumatic nondisplaced spondylolisthesis of third cervical vertebra, sequela;2023-07-09T00:00:00.0000000+02:00;False;16140;4;0
Toxic effect of rattlesnake venom, undetermined, subsequent encounter;Lupus erythematosus;2023-11-10T00:00:00.0000000+01:00;True;53861;4;3
Striking against diving board, subsequent encounter;Laceration with foreign body of unspecified part of head, subsequent encounter;2024-12-04T00:00:00.0000000+01:00;False;765;0;1
Tributary (branch) retinal vein occlusion, right eye, with retinal neovascularization;Laceration without foreign body of nose, subsequent encounter;;True;27677;4;2
Displaced fracture of medial condyle of left femur, initial encounter for open fracture type IIIA, IIIB, or IIIC;Unspecified nonpowered-aircraft accident injuring occupant, subsequent encounter;;True;60988;3;1
